My four year old has become Topsy and Tim daft in the last few months, back to back watching on youtube.

And, as they sometimes do, my ears perked up every now and then, because something is just "off".

The mom says something about their fifth birthday coming up, which would make them the same age as my youngen.

These kids are all clearly 8-9 years old.

Then I realised, all the kids these kids interact with think they're 4/5 too.

This morning, I saw a "nursery" episode...
https://youtu.be/jb_uNNJE86s (about 4:12).

And it finally clicked, these little buggers are all in a cult. They're all being home schooled, and kept away from the mainstream. Their parents have all told them they're 4/5 so that they don't appear significantly behind their "peers".

Their parents never react to hardship, or show any negative emotion... because the cult would have them demoted.

Topsy and Tim are scientologists, they live in a secluded neighbourhood and raise their 8 year olds like they're 4 to keep them suppressed and secluded.I'm just out here ranting but here's today's fun and games.

My 4 year old has chicken pox. They started coming up on Sunday morning.

r/iama 30-something year old humira patient with no immunity to chicken pox.

So, today has been fun. All of the documents say "call the IBD nurse and your GP, you need antivirals".

Obviously, this started on a Sunday so that's one day behind on treatment. These things always seem to come up on Sunday.

Today I worked while managing the calls between the doctor and the hospital. The IBD nurses were their usual useful selves, advice on what's next and who's to do the work (the GP).

The GP has been a massive pain in my arse. And, I know arse pain.

I called them at 8:30 and requested an urgent appointment. The doctors surgeries here are pushing the whole back to the office thing... so, I first got pushed towards an in person appointment. Not a huge deal but it meant starting my day explaining the situation to the receptionist, because "I need a telephone appointment this morning" isn't enough.

I can still hear the dissatisfaction in her voice when booking the phone call.

Again, got the appointment, it was a pain but not a huge deal.

Appointment comes, doctor calls me. Has zero fucking clue. I understand biologics are not prescribed to lots of people, so there will be people who don't know what's up... not a big deal.

So, I started the call by briefly outlining the problem and what I understand the solution to be. Cheatcodes; I know what the deal is and I'm happy to get us all going the right way, save having to say "ummm, idk" to each other a lot.

This doctor though. He made it really clear that he had no idea about the medication, but was also unwilling to try finding out... or consult with someone who may know.

He started by saying "you're gonna have to talk to the IBD nurses to get xyz". I already have, they said this is y'all's job.

"okay, we're going to send you for a blood test". "I had it in 2018 and have no immunity, i started the call telling you this".

"if the blood test shows you have no immunity you'll need the vaccine"... this one annoyed me, on humira you can't have live vaccines. All guidance effectively says "this is an urgent situation, best practice is to prescribe antivirals and monitor, avoiding all delays".

Long story short, I get to spend tomorrow in hospital because the GP is not competent. I complained, the doctor who picked up the complaint stuck to bloods before treatment, despite them being useless. But, now everything's "urgent".

Fuck Crohn's and fuck doctors who can't be arsed to look at their own medical institution's guidance before deciding on a course of treatment....made to feel terrible about having Crohn's by my (soon to be former) employer.

I started my Monday with a quarterly appraisal. Which to be honest started fine, I'd met my goals for Q4 2022 and my goals for Q1 2023 are to continue working on what I'm working on. Great right? nah, because as a sort of tag-on to that meeting I was then informed by my manager he intended to put me on a Performance Improvement Plan for poor performance. What even is that!?

So, after my appraisal; that my performance was as expected, I got told my performance was sub par.

When I asked what the reason was, I was told "the team feel you can't be relied upon for deadlines". I quickly challenged this.

Here's the important bit, in Q4 I unforunately had higher instances of time off due to Crohns and Crohn's related illness. I'm on Humira, so go figure; I'm disabled and going to be off more. I'm not paid sick leave, so I'm not going to be off unless I have to be.

Having said this; the work got done, I'd met my objectives for the quarter. I called out my manager and said "what you mean is you don't like that I have more time off sick; because I'm chronically ill". He had no other answer to this. The really shitty bit is I do meet deadlines, I'm reputably good at my job. I'd met my objectives for Q4.

This is the third instance of blatant discrimination in the last year. 

I was dragged into the office to explain my (already explained) absences in front of my manager and the head of HR. No action came of that meeting, it felt brutal to have to explain being chronically ill to people who should be well aware of the impacts of being chronically ill.

I then had another member of staff make a derogatory remark along the lines of: "you'd be a better employee if you were in the office more". Oh, I'm a remote worker, useful to know.

And now my manager tried to start a disciplinary procedure for my performance at the end of an appraisal, that said I was performing as expected.

I'm exhausted, exasperated and now get to spend tomorrow seeking legal advice. I'm certain pressuring an employee to resign over their disability is illegal in my country (I'm in the UK).

I provided notice of resignation after cutting the meeting short.

I honestly just came here to vent because the sub has provided me with a great deal of reassurance and comfort. 

But, I would love to hear if anyone else has experience with discrimination in the workplace. It sucks feeling isolated and alone in this situation.

Oh, I then had to go to the dentist to have a root removed from a recent dental fracture, it seems like that's also the Crohn's.

Today my face and state of future employment do not feel good. Fuck IBD.I'm asking because I'm feeling pretty defeated today. One of my bottom molars fractured and came out today. 

This leaves me with one molar remaining on my bottom jaw. And one wisdom tooth, which isn't much use because it grew in facing forward.

So yeah, how's everyone's teeth?

I'm aware of issues relating Crohn's and dental problems, I never thought it would get this bad. I was originally diagnosed 2012, have been through the ringer on different meds, I'm now on Humira and the closest to remission I've ever been. But my teeth are horrific, I've lost so many.

Today is not a fun day.Hey everyone,

I bought the fanatical birthday bundle a bunch of times and got some doubles to give away.

Comment at the top level with what you'd like and I'll do my best to give them out first come first served.

I have spare keys for:

Sid Meier's Civilization® V (2 copies)

STAR WARS™ - The Force Unleashed™ Ultimate Sith Edition

Dishonored: Death of the Outsider

Hotshot Racing

Fire: Ungh’s Quest

Cook Serve Delicious! 3?! (2 copies)

Radical Relocation

Rebel Galaxy

Wolfenstein 3D

Doom II

edit: formatting

edit 2:

All claimed and users DM'd.
Thanks everyone for taking them off my hands quickly, sorry to anyone who missed out.I absolutely love Apollo, and have an odd question about how people would go about doing this, if it’s not already a feature.

So, I’m browsing r/NintendoSwitchDeals, and most of the posts are for the US. I’m in the UK, there are some posts but I can’t see them for all the US posts in the sub.

How can I go about only seeing posts in that sub with UK in the name?

I’ve tried searching and sorting but it’s not ideal, has anyone got any other ideas?. There’s so many things and so much background here I don’t know where to start. 

But; TLDR I’d appreciate advice on best way to deal with long term alcoholic in-laws. We are in the UK, currently living with them and will be relying upon them for property for the foreseeable future. Any advice no matter how small would be appreciated.

So, I’m laying in bed, can’t sleep because my evening has been a nightmare. We are currently living with MIL and FIL, and we are renovating a property on their land to move into in the immediate future. We have a ten day old son, and my partner has a 5 year old girl.

This evening I upset my partner, and she went upstairs to our room, to breathe and feed the lad. Dinner was on, being prepared by FIL. I went upstairs to talk to my partner about upsetting her, so we could get each others’ perspectives and make up. Having just given birth her hormones are all over the place, but I’d also done something to upset her, so I apologised, explained and she forgave.

Once we had both settled and cheered up a little, and the wee man had finished his boob we decided to head back downstairs to resume the evening, eat dinner and maybe get an early night.

We got downstairs, I took the boy into the living room to check his nappy, whilst my partner went to check on the 5 year old. Soon after, MIL angrily summoned them both into the room I was in, and proceeded to shout at my partner. Her grievance was that we were half an hour late to dinner but you’d have thought she’d been caught stealing or fighting someone.

Her general points were; you were late to dinner, your dad slaved over it, you guys suck.

My partner obviously explained she was upset, and feeding the little one, unfortunately he doesn’t work to anyone else’s schedule... this fell on deaf ears.

I held my tongue and was fairly angry but stuck to just letting it go, until MIL re-entered the room to single me out, she made the same points, but this time I was a little more firm in letting her know there was no way I would leave my partner upset to return to dinner.

The crux of the issue is that MIL and FIL are long term alcoholics. Today MIL started drinking at 12pm, this occurred at 6:30pm. She had had approximately a bottle and a half of a strong spirit. FIL is in a similar state. I know MIL would not have been so vile had she been dry.

Having said that, MIL and FIL do this every day. The routine goes something like; do some work from 6am to 12pm, start drinking. FIL then gets angry at insignificant things and makes snide remarks to MIL which obviously puts her on edge. 

She then proceeds to take this out on whomever she can, given the smallest of excuses to do so. Like missing dinner because having a newborn is damn stressful. Another example of this is that approximately a week ago we found out that the house we’re renovating on their property has a rat issue, and MIL felt that us discussing this was in some way calling her dirty. We found the issue when pulling up a broken floor board and there’s no way in hell she could have known, or had any impact on the issue.

The living situation is obviously a little odd, we moved in with the in-laws as they offered us a now vacant property on their land which needs a little TLC. 

I’d like to stress as well that they are good people, I have the utmost respect for them both. They offered us a cheap place to live and helped us through the birth of my first child. They are wonderful when they’re sober. Unfortunately that’s 4 hours we see them every day. More than half the time they’re drunk. I think this is an illness, my partner has dealt with it for two decades so she’s more inclined to think it’s just the way they are. Both are now experiencing medical issues which are exacerbated by alcohol consumption.

I have had to spend the evening consoling my partner, and the 5 year old who clearly understands that Nanny is upset with mummy and me but not quite why. We didn’t eat dinner because that’s a bit difficult to do whilst everyone’s crying and of course that means my partner who is breastfeeding is most likely malnourished. I understand the issue that MIL and FIL had, I don’t think their reaction was acceptable, I know it was caused by their alcoholism.

I have told my partner that I will only advise and act on what she says as I don’t feel it’s my place. I’ve also told her I back her with whatever she wants to say or do. I have also let her know that I feel her and her family’s behaviour is enabling and does not help MIL or FIL. I feel that enabling them leaves everyone just waiting on them to die so they don’t have to walk on eggshells, nobody wants to be remembered like that.

What do we do? We have about 2 weeks until we can move into the other place, we’re dependant on MIL and FIL then as well as it is their property, we have the finances to pay them rent but doubt there will be much of a contract involved at present. We also have enough in savings to renovate, which could easily be repurposed to rent elsewhere privately but this would likely cause a rift between us and that’s also not in anyone’s benefit. In the mean-time we spend every afternoon hoping they’re in a good mood. My partner and I don’t think they know or admit they’re alcoholics. They have been advised multiple times in the last year to stop, by their doctors. They had a good go at stopping once, but have not made it past the “stopping spirits” phase.

In my own personal experience I’ve found that this only turns around with loss, pain and suffering.

If anyone has dealt with this, anything similar, I’d appreciate any help. We’re in the UK, if anyone knows of any third parties able to get involved.Just for fun, or the enjoyment of synchronicity, I was thinking too hard about video games instead of real life and remembered back in high school I was comparing star wars3 to dmc3 to mgs3 at lunch....and decided to rethink it

MGS1 DMC1 - Dante/Snake

MGS2 DMC2-  Dante and Lucia / Snake and Raiden

MGS3 DMC3- Origin Story Prequel. How they got powers/Banada/Eyepatch

MGS4 DMC4- Older Dante Older Snake. Younger Rising Protagonist. Nero/Raiden. Ocelot has arm of Liquid. Nero has Arm of Vergil. Liquid and Vergil both rivals and Twin of Protagonist. Solid and Liquid. Vergil and Dante. Nero and Raiden both voiced by someone as badass as David Hayter. Games are full of just badass voices.

MGR DmC- Spin off that didn't do so hot. Play as recreated idea, or character. Both games final release changed story and characters from reveal to launch. 

MGS5 DMC5 "V" - V as a theme for Vergil, V, Venom, 5, protaganist has lost arm, isn't who they are, a phantom double, or wakes up from a long sleep. Twin rivals make re-appeareance. 

Also arms based on Mecha. Jehuty and Gundam. 

Star Wars: origins, twins, robot limbs, replacement Protagonist, waking from coma, living a lie
JoJo: don't even. The upside down
Mind Flayer Behemoth, seems to have head like a Demogorgon Demodog
The music, unsure if Survive was involved.
I know Kojima had similar inspirations and is a fan
Trailer 2, the tentacles on the tank are familiar.

I know unrelated, but nice brain candy for the idea of other dimensions. 

I just want to.mention the upside down because of how gravity seems to go upside down, and the handprints maybe from a tear/rift. Where can I see the video where the father has his son around his Gundams, and hes cautious about them, and his wife comes home and I think knocks over his RX-78-2?

I remember seeing this as some facebook video, like it was a commercial or part of a tv show. It was an Asian Live Action TV show, and I remember sharing it with some friends about...if I was a father, this would be me.

I can't seem to Google or Find it. Has anyone else seen it, or remember it?. I became Demon Snake around December by building a Nuke or Two. I wanted the Trophy and to see the look, and I think it took me two Nukes. I was very unhappy with the look, and spent my casual free time trying to capture animals, Missions 23 and 25 either fulton, or chopperin(not chopping) the kids, and some Animal visits. I'm still blood soaked with a horn after a few times a month casual play and 2 nights of what feels like stressful grinding where I just want to go to sleep now.

Are there any methods or way to see demon points. 

I hear there is a cooldown for the animal platform

and theres also a Refugee Combat Deployment that needs 20 S+ soldiers.. So I finished the series and the movie Awakening of Trailblazer. Didn't like it at first but after thinking about it, with all these riots and protests I saw some connection. So I've accepted its ending.

I'm still a little lost, I can assume the ELS backed off, and Setsuna went MIA..thus mankind chilled out and evolves...but did the ELS doing anything else? Or just remain a dormant flower. 

Did Setsuna go to Jupiter, or the flower? 

Leaves me to..what happened for 50 years. What did he do? Hibernate? Chill? Is QanT outdated now or the new G² Gundam?

I can understand not aging, as an innovater merged with ELS, but if anyone has seen Interstellar, could he have possibly through time and space spent less time doing his communication with the ELS in correlation to time on Earth?

I can't seem to find any good theories, and maybe its best untold, but I'd like to stop wondering :).Anyone know anything about this podcast?  Or its creators?  I see stuff like this and wonder if it is one of those podcast that slowly get people to leave the church? Or mingle the philosophies of man with scripture to justify their lifestyle or skewed thinking?. Hello All...Our son is considered Level 1 autistic.  I'm learnering so be patient.  All this is very new to us this year.  He performs "o.k." in regular government school but we do worry at times about how well he is doing socially and also the training of the teachers.  None of the teachers have formal training in working with ASD just expereince with having them in their class.  

Another question we keep having is....Is our child acting like a 3rd grader or is this "autism"?

What expereince have you all had in either keeping them in the Government School on a EIP or pulling them and finding a "specail" school?  Do these schools exist?  Are these schools only for Level 2/3 kids? 

Thank you all so much.  This group is amazing.I’m so pissed right now. My pediatrician just told my wife today that there are “now” new studies that state the MMR vaccine may trigger autism. Why the hell would this person say this? Are there really new studies out there showing a link? The seed of doubt is now placed in the mind of myself and my wife.  What if we go forward with this vaccine and our little daughter also has/gets autism like my son? The pediatrician also stated that since my son also has autism she would definitely not get this vaccine. I need some advice. I’m so freaking annoyed right now and I don’t know what to do.

UPDATE (19 hours after original post):  We asked for information and she shared this:

Hi there! The best things to reference would be the following books:

The Vaccine Friendly Plan by Paul Thomas, MD, and Jennifer Margulis, PhD

Dissolving Illusions, Disease, Vaccines, and the Forgotten History, By Suzann Humphries, MD,
and Roman Bystrianyk

Miller’s Review of Critical Vaccine Studies by Neil Z. Miller

Children's Health Defense also has a ton of great information and summarizes studies and articles that are not always easy to find: https://childrenshealthdefense.org/defender/ (https://childrenshealthdefense.org/defender/)

Here are 2 that relate to our discussion this morning 

https://childrenshealthdefense.org/news/cdc-data-reanalysis-shows-strong-statistically-significant-relationship-between-mmr-vaccine-autism/ (https://childrenshealthdefense.org/news/cdc-data-reanalysis-shows-strong-statistically-significant-relationship-between-mmr-vaccine-autism/)


https://childrenshealthdefense.org/press-release/the-need-to-further-investigate-mmr-vaccine-autism-relationship/ (https://childrenshealthdefense.org/press-release/the-need-to-further-investigate-mmr-vaccine-autism-relationship/). Everything in title. TIA.Wondering if I’m overthink this?  I put my panel at 37 for the fridge but based on a couple fridge thermometers I bought on Amazon it doesn’t get lower than 40.  Should it be going lower?  Should it be accurate?  If it isn’t falling below 40 will be food be ok?  Who knows about this crazy science?. Example...I see deals with Disney/Hulu and then also my Amex card says I can get another $7 off if I use my credit card on these services.  Is there a website where I can say...I want Hulu, Disney, Netflix, and Max...and it show me how to get the best deal on these services?. https://www.tiktok.com/t/ZT88H8nqq/. Historically I had a lot of flare ups around my perineum.  To calm things down I go to my Derm and he gives me some shots directly in to the inflamed cyst/pocket/sack or whatever and it provides me relief for weeks or months.  I've been good for a long time but there is a remaining bump that is about the size of a tootsie roll and a couple sensitive spots.  Couple questions:

1.  The lump that is the size of a tootsie roll....Could this just be scare tissue?  I don't have any leaking of any kind but it is just always there?  Should I be worried?  It doesn't get bigger or smaller.  Occasionally I think it gets annoyed because I'm a triathlete and cycling does annoy this area.  Thoughts on if I should get another shot here?  Leave it alone?  Worry about it?
2. Around this area I point out above is a couple small red bump that I "think" is the draining location, annoyed hair follicle, where the derm does his shots, or whatever.  This little bump is some thin skin because I think it is scar tissue from repeatedly  getting popped/drained/etc.  This thin skin can be sensitive and hurt like hell at time when it rubs against my skin.  It also itches at times. Advice on topical ointment I can use in this area to reduce pain or sensitivity of these little bumps?

Thanks all!  I really appreciate this group!

&#x200B;. I finished my basement 6 years ago.  Did the electrical myself with help/advice from several commercial electricians I do big project work with.  Passed all inspections etc with the city. Not sure if any of that info is relevant but passing along.

So it has been 6 years.  I have a dedicated circuit for my lights in my living room.  After 6 years the circuit has popped twice today?  What could cause this?  Do these ARC Fault breakers go bad over time?  Does it matter that I live in the south where it is hot and humid?. So yeah...if I'm looking for a unicorn I understand....

More and more I think the Med diet will work for me.  I just need help working through some time, texture and taste logistics.

Few things in no particular priority:

\-I DON'T like mushrooms (Texture), moldy cheese (Taste), olives (Taste), capers (yuck), raw tomatoes (Texture), Kale (Texture and taste) and hate mushy squash  (Texture) ---So I get torn given so many recipes have these items....Advice?

\-I DO like salmon, chicken, breads, Non Moldy Cheese,  basically like most all dairy, Soups, Fruits, carrots, potatoes, peppers, avocados,  all fruits, most beans, most nuts, most legumes, I'm ok with Seafood just not crazy about it, most non bitter vegetables

\-Time - I'm sure this is for everyone but what do you do to save time on cooking and planning your meals?  What kind of meals last longer that we can make up front that will last for a few days?

\-I'm trying eMeals for a few months to get exposed to different meals and learn a little bit (They have a Med option)

\-I'm not a good cook....I'm terrible....I mess up boiling water...What advice would you give me in preparing Med meals

\-I don't drink alcohol

Thoughts?

TIA

&#x200B;. I’ve seen several post about this issue on forums but can’t really seem to find the real answer.  I suspect this is an e90 issue and the M3 aspect is irrelevant.  

So yeah.  Hot outside.  AC on Auto. Cold air comes out the vents but I’m feeling heat on my feet.   If the AC is on and I hit manual feet only it still is heat.  Manual vents and nothing else I get cold at the vents.  Hope these random details help. 

Thoughts?. My sister-in-law is currently living with us as she just recently was divorced. She has three kids ages 8-14.  Given the recent divorce I’m sure celebrating Mother’s Day is not on anyone’s mind. And unfortunately, she never really did get a good Mother’s Day because of how lousy her ex was. I want to provide some coaching for the kids on what they could do to help make her Mother’s Day as best as possible.

To all the moms out there that have experienced something similar, or are going through something similar, how can I help her enjoy her Mother’s Day.   Not to be too selfish, but keep in mind I have my three kids, my wife and a new infant along with my mother that I’m making plans for as well.

