I told my mom what happened and she said, "you know, you don't have to show up anymore," and I realized I wasn't there getting payed crap to be treated like crap, so I'm finally quitting! Whatever happens there is not my problem.After a serious slump in the winter, spring has shown me it's time for new beginnings! This spring I:
- Got a job
- Finished the quarter with a 3.8 gpa
- Was approved to take AP Psych next year
- Washed my hair by myself (really big thing, hair washing is a sensory problem for me)
- Made new friends
- And on Wednesday I get my driver's permit!! This is huge because I thought my adhd would never ever let me drive.

- I actually wanted to make this post a while ago, but y'know I forgot...I've been on estrogen based birth control for 3 months now. At first it made my period last longer, but then it significantly reduced cramping and cysts. I should have had my period last week. Has anyone else had missing periods on birth control? And no, I haven't been having sex.My boss, Jim, still hasn't stopped screaming. I've lived without a dick, so can he :/. I'm really conflicted at the moment.

So there's this guy, we'll call him Ty. I've been applying for some jobs recently and I'm hoping to work at this one shop where Ty also works. Keep in mind Ty is very respectful and helpful and from what I can tell, kind. 

We've been chatting a lot more ever sense I asked him for advice on applying for jobs, managing money, red flags while working, ect ect. While we were catching up he invited me to his place and my parents are actually ok with it.

We've been talking a lot today since I met him at the shop he works at and got to know what I'd be doing if I got a job there. Then he brings up thc. Hear me out: I'm not against hemp/thc/cannabis/marijuana or anything like that as long as you don't drive under the influence or become violent with it, like alcohol. But I am against the smoke. I have moderate asthma that seems to be worsening every year. He smokes and that would really not be good for my health. He went on about different ways of consumption because again, he's respectful. But he still wants me to try it.

What should I do? Say yes and only consume a little bit? Say no and just play video games with him while he's still high? Or do I just blow off our hangout and make things tense between us?

Tl;dr: friend wants me to try thc, and my decision may make or break our relationship as friends and possibly co-workers.

Update: I said "dude, please respect my decision. I don't want to smoke." Fortunately, he was as respectful as he normally is and replied with "okay, I clearly can't convince you of this but for the most part it's pretty safe, even if you have asthma like you and me. I respect your decision to not smoke, but I know from experience that it doesn't fuck u up you feel me

I will get extra eddies in case you would like to try them on the day, but beware, they are POTENT 😂😂 I'll make sure you're safe though that's the number 1 concern". So far this has been the best birthday. My mom bought me lots of makeup and took me to hot topic (which was an _experience_ for her) and I played video games with my dad. I've also gotten several birthday wishes which is great bc normally ppl forget my birthday.

So yes, it's been a good day. Going to update my age right after I post this.I have to write a 2 page paper about 3 of my core values in 2 hours and 19 minutes and I couldn't care less... What kind of fluff/bs can I add to lengthen my paper?. I have to take personal finance because it's required to graduate. Even though I KNOW the material, I bomb every test. I just want to get it over with but it's dragged my GPA. As of now I have a 70 (C-) along with all As. The only thing keeping me from an F is the petty assignments that practically give out As.Like I'm not complaining. At least I can have a debit card. But I have to be driven everywhere and 5 times out of 6 my brother has tag along with me.

Also, I'm the youngest in my grade. I won't be able to drive until halfway through my junior year and everyone in my grade has a real job (compared to me selling stuff on Etsy). But at least I'm not in middle school...So I was on a date with my GF and I offered to go to my dad's place (he wasn't home and it was only a few blocks away). So we get there and I'm being all awkward and I just said "fuck it" in my head and just kissed her mid sentence. Then one thing led to another and I fell off the couch and screamed "THAT WAS REALLY COOL BUT I NEED TO GET MY INHALER!" I also gagged when she put her tongue in my mouth and that was... fun. But other than that I had a GREAT time and now I have love marks on me. This post is a mess but so is my brain right now because I literally cannot believe what just happened!!.So I have a lot to tell. First I would like the story of the old cataclysm back just after rauru and Sonia’s time. I think the ancient hero on the tapestry would be the “hero” and Sonia’s child (which was not shown in totk but did exist) would be the goddess’s incarnation. The Sheikah also existed at this same time so they are in the process of building the divine beasts and guardians. The old champions would also be shown. This would be 10,000 years before totk and botw.
The ancient hero, I would like to know about. Was he a lomei? I did notice similarities between his green skin and ganondorfs, and the zonai clothing made me think maybe he was the last of its kind and got adopted by zonai? His tail also matches with the demon dragons tail too, and the diadem on his head would be a placeholder for a secret stone (like ‘dorf). I would also like to know about the dragons. I want to see who they were before and why they turned. Did they do it for a holy quest in the name of hylia?

Let me know how to further develop this!!. It sucks. He was a ***** and we don’t deserve to be called after him. Vote for a new name! 

For a bit of context: Asperger was the guy who “discovered” it. He basically kept all the high functioning people with autism and sold the rest to be killed by the nazis. I had nightmares every night until I was about seven years old. I then learned to wake up when I was too scared.
I later learned to, instead of waking up, control my own dreams (lucid dreams which originally weren’t) 
Controlling them still requires the most amount of concentration I have ever used and they are always imperfect
I can decide where to go and what do to, how the world is and what people or objects do, but I end up forgetting everything in a few seconds so they don’t follow a straight line.
My dreams are weird as hell still, like a surreal painting. I have been trying to solve ancient hero’s green skin and noticed the similarities between him and ganonsorf + kotake and koume. Is this normal?

My mother uses my autism as an excuse to skip lines at airports and similar. Because of the country I’m in, I also get coupons and get to skip lines at theme parks

It also makes me very embarrassed and uncomfortable. Why do I have any more right to do these? It’s not like I should be pitied. Hi I’m autistic and ADHD. I get along with both ND and NTs very well, so I’m happy to share helpful tips. My mother uses my autism as an excuse to skip lines at airports and similar. Because of the country I’m in, I also get coupons and get to skip lines at theme parks

It also makes me very embarrassed and uncomfortable. Why do I have any more right to do these? It’s not like I should be pitied. If you have trouble with loud or sharp sounds this might help

There are some items named calmers that can reduce stress by filtering sharp sounds, the perfect autism tool. They helped me manage stress. Just wanted to share this cause it’s helpful, they allow you to still hear while reducing anxiety. My psychologist recommended them to me, apparently they helped others with the same problem.Has this happened to any one of you guys who might be crips? I ask as a tree-top PIRU.My husband and I are both gonna be skipper from “Gilligan’s Island.” Anybody else wanna be skipper with us? Maybe a few Gilligans out there? Neither of us have the BMI to be anything but a skipper. Secretly wanna be Mrs. Howell. Well anyway what y’all doing?. I grew up playing piano. I had all the Tori piano books from little earthquakes to choir girl. I’m trying to re learn the songs but, as my fellow piano players know, the transcriptions in those first few books weren’t exact so sometimes it required listening to the song and changing transcriptions. What I ask is this: Muhammad my Friend was one of the more correct transcriptions but I can’t find it anywhere. I can still play the intro but do any of you have like the first part when the actual song begins or can tell me the notes? I’m embarrassed kinda that I can’t seem to pick it out by ear. It just doesn’t sound right. Any help appreciated and let’s talk about other songs too, which ones you like to play. I still have Winter and mother down, at least lol. Thanks y’all!. For me it’s probably any quote from Heathers or Sleepaway camp. What’s yours?. Last season it was Nynaeve. This season it’s Seanchan. Yes, I am aware of the glossary that is in all of the books, with pronunciation, but who really looks at that? And I haven’t done the audiobooks so maybe it’s different? Lol but I want to know which ones threw you off, ones that you pronounced differently and was, idk like “canon” for you?. Where could we have it at and what restaurants/wealthy families/gentrified neighborhoods will be our main focus of conversation for the evening?. But I just can’t decide who would play her the best? Who would be your choice?. I was a big time hater of the show, at first. Then I decided to reread the books, after years. I’m on book 8 now and I decided to rewatch the show again, in anticipation of the second season coming out soon. Love it or hate it, it’s my favorite fantasy book series and I was gonna watch it regardless. Well, after rewatching it, I fell in love with the show. There is SO FRICKIN MUCH foreshadowing to the books, even books way ahead of the time frame in the show and I am loving it! I guess I am seeing through a different lens, and being less myopic, idk but anyway sorry I was a hater. I understand why they had to make some changes and I understand COVID kinda messed hings up towards the end of the first  season. And although I don’t agree with some of the changes, overall I’m so thankful I’m getting to see these books on the tv screen, and I’m very much looking forward to the second season! That preview has me so excited! Love y’all!. Pep boys tried to run game on me. Usually I go to vannoys but do any of you have any better recommendations??? It’s a midsized suv. Ford. Much appreciated!!!. I have been following this sub with my husband for awhile. Watching what y’all like, the good deals, and what to avoid. We just made grocery’s there tonight shall and bought all the things (except Turkey and chicken which we get at BJs) and we saved about 60 dollars!!! Thank you guys so much! We love this group!!!. I know lots of you have been going without. Apparently several pharmacies in the area are in stock as of today. The two named above, I know coworkers who had theirs filled at both those locations today.We went to Shan Kishi in the Publix shopping center in Gulf Breeze proper based on a recommendation from some dumbass I barely know. The food was less than mid. Got several sushi rolls. Nothing special. Anyway they brought me a receipt for a certain amount and I get bank notifications so I saw they charged us EXACTLY 20% more on the ticket but didn’t tell us nor did it show, anywhere, on the ticket. I asked and they acted like they had no clue what I was taking about. But my bank showed that extra 20%. Is this normal? Have any of you had this happen at a restaurant in the area recently?. I have been taking 20mg of edibles every night for two years. I need to quit for reasons and how bad will I not sleep/withdrawal? I was told it was a wuss amount but I know y’all have really good experience. Should I ween? How should I? Thank y’all!!!. Do I present before the city council? Are their fees involved? (We are willing to pay) and have any of you had experience with this before??? Of course you would all be invited. It’s for my and a neighbors birthday. Thanks in advance!. Did any of you grow up in Alexandria and went to OLPS (our lady of prompt succor) in the 80s and went to Bolton in the 90s? I would like to compare stories.As I was cut off in traffic today and had someone almost rear end me, I thought how I could control my anger. I’m going through some new therapy and I’m trying to find creative ways of pulling me out of my anger. Anyway, a car cut me off on 12th in east hill, then flipped ME off. Anyway the same car was to the side of me going west on Fairfield, at the ninth intersection. They looked at me and flipped me off again. I thought “what can I do to not want to kill them?” I saw a r/houston post today and it inspired me. I unbuckled my seatbelt, took my money out my g, and I just got on that damn hood and twerked. Y’all. It felt so fucking good. Right before I lifted up my ass towards the car, they looked at me in admonishment, and I flipped them off and jumped back in my car. I feel healed. Thanks for letting me share.

Edit: many words. I’m performing exams today in my secret RV abortion office but I can’t find my speculum! Last time this happened, a nice redditor suggested I kill one of my prized ducks and fashion their bills with one, but they dead. What could I use instead? Help me, please.I would want Mariah Carey (not really a fan but she got that octave  range) to do Wuthering Heights

I also want to hear slim thug/Mike watts do a chopped and screwed version of Wuthering Heights. 

What would you want to hear?

Edit: a word.I’ve been leaving my boys outside overnight bc of the humidity and giving them morning sun. And they are thriving! I have a carnosa splash, crimson princess (reverting :() pubicalyx silver splash and an obovata variegated. And they are doing amazing. Is it the Florida humidity? How do you Florida hoyians do yours???. Is there another way I can make them? Steam in a pot with a lid and some water? Without the steamer rack? I know they will slightly brown on the bottom if I do it this way. They are crab soup dumplings. Any tips? I’m desperate lol. Thanks I’m advance!!!. I was wondering if any of you had experience with this? I’m going to a meeting this morning and not sure how to deal with that aspect. Last time I just shared and included I was autistic and so at the end of the meeting they acted like they understood but I don’t want to keep sharing “I’m autistic pls don’t touch me” at every meeting I go to. Thank you all!. Didn’t get a pic bc duh I don’t want to get hit by an egg but wtf is going on lately?.[Disclaimer: This was originally going to be related directly to autism and PDA, which it still sort of is, just less directly. Which is why I’m still posting on an autism sub instead of elsewhere. ]

[Disclaimer 2:Words are hard.]

Like, I get wedding gifts and other REALLY special occasions that only happen five or six times in your life, but what the hell are these presents I have to get you every year? You’re an adult with your own fucking income and you can very well pick out what you want yourself. 

I don’t want or need half the shit that I myself have gotten for these occasions, because most of it is just that—shit! 

“Oh, but it’s nice to be thought of.” Well, you can express that by calling me! On second thought—DON’T!! I’m letting that go to voicemail. Send me a text so I can answer it in a month or two when I’ve thought of an adequate reply. 

Ok, mother. I’m looking at you now. You said you didn’t want anything, but I know better. You just want me to SURPRISE you. Great, you don’t know what you want and aren’t going to spend any time thinking about it, but you’ll be upset if I get something you already have. And now that I have kids, I have to buy MORE things and pretend that THEY got them for you. COME ON! And I have to do this for your birthday, for Christmas, AND for Mother’s Day?! For fucks sake, can I just get you a card for endless endless breadsticks and call it a deal? Everyone else is on their own.

Edit: In case anyone was wondering, dad died. He’s already getting his endless endless breadsticks. No gift card required.I had the displeasure of seeing a mom and her 12-13 year old clearly autistic son interact for about 5 minutes, and it made me really uncomfortable. The boy sat down, and was doing nothing more than rocking and hand flapping, and his mother kept trying to get him to stop. At one point, she said, “Will you stop wigging out?” and even put her hands on him to make him stop. He was also trying to play on his tablet.

When he would try to communicate with her, she would shush him. I think she shushed him at least ten times in the five minutes I was sitting near them. She told him he was being too loud even though his voice was no louder than hers. I felt she was very invalidating and infantilizing toward him and it made me sad. I wondered if she had “Autism Mom” stickers all over her car and posted in her Facebook groups about how hard she has it. 

I guess I just wanted to share.

Edit: Someone said I posted this “just to get upvotes.” Lol what? No. I was thinking about the kid all day and wanted to share about it. I didn’t expect all the hate. This boy was QUIETLY STIMMING and got basically told he needed to push all that inside.

He didn’t do shit to merit the reaction he got from his mom, and I don’t feel I deserve the reaction I’m getting from some of you here. I mentioned I raised (in fact I’m still raising—they’re doing better now) 4 challenging kids. My kids had to do something crazy to get a reaction out of me, like punching of biting each other or breaking something. I would have been fucking overjoyed if any of them would have sat quietly in a chair rocking back and forth for five minutes, asking me a question now and then. But somehow I LACK EMPATHY if I’m upset that this lady told her kid to SHUT UP 10 times in five minutes because she might have been having a BAD DAY? That’s not an excuse to treat your kids like shit! What’s wrong with you people? 

Also, for those of you who would like me to “just chill,” trauma and PTSD are not things that you “just chill out” from. You can try posting on /r/wowthanksimcured.So I suspect very highly that I am autistic. I have for about 2-3 months now. I’m still putting pieces of my life together, but it all seems to point in the same direction. All through childhood I got called names like spaz, crybaby, etc., you know, because I would freak out over shit that other people didn’t. 

Fast forward to tonight. My 9 year old, who just had surgery to correct relapsing clubfoot on both feet—she’s wearing two leg casts and can’t walk—is sitting on the floor in the living room. My 14 year old, who already despises the 9 year old, and who I’m convinced is autistic, decides to start laying into her little sister yet again for this disruption to her environment. After a brief back and forth, the 9 year old starts wailing. Loud and pathetic and it wouldn’t fucking stop. It wasn’t long before I started freaking out internally. I wanted to scream, I wanted to hit myself, I wanted to run away. What I did do was go to the kitchen and start slamming the back door. Thank goodness I didn’t break anything back there. All the glass and wood is really old, and we are quite broke at the moment. 

After that I just sat down in front of the sink with my head in my hands and stared at nothing for I don’t know how long. People were coming in and out of the room and I barely noticed. It’s been a half hour since all that happened, and I still haven’t spoken to anyone, and if someone came up to me right now I don’t know if I could. 

Is this what meltdowns feel like? I feel horrible. If this wasn’t a meltdown (and I realize it was a short one if it was), I don’t want to experience the real thing. Anyhow, thank you if you read this far. I appreciate your honest but gentle feedback.

Edit: I forgot how good I am at masking. My neighbor walked by with her dogs (I went outside to get some air as I finished writing this post), and I was friendly as can be. Just flip that switch!. I’ll just casually be browsing Reddit then AAAAAAAAA!!! No, wait. That was a different post. Anyway, I’m just browsing along, reading the comments, and I can still scroll the comments on the post I’m on, and that’s it. The back button doesn’t work. The home button doesn’t work. I can’t get out unless I close Reddit altogether, and half the time I don’t come back. I’m on iOS btw.For context, my daughter had lost two friends now because of her friends’ parents overly harsh punishments, in my opinion. Today, her friend and her little sister came over to play for a couple hours. Her friend brought some art supplies, and her little sister brought her phone and a notebook. I rushed them out of the house to get them back to their grandmother’s on time. They forgot to grab their things on the way out. Just as we were pulling into the driveway, they realized their mistake. As a punishment for this minor infraction, grandma said that the girls can’t come over ever again. My daughter, who is 9 and already has a difficult time making friends, was crushed.  She punished my kid as much as her own, and for what? We live 5 minutes away, and they got their stuff back almost immediately. 

I see a kid’s social development as super important, not as a privilege. I say as long as the kids aren’t getting into anything harmful or illegal, they should be allowed together. Of course consequences should be had for small infractions, but this kind of punishment is just wrong to me and I don’t understand the thinking behind it. 

I want to know your opinions.I was assaulted by cops in 1999. I don’t feel like posting the details here, but I just posted the full details on Facebook under my real name, calling out the cops by name, sharing details of what happened, including how no fucking lawyer would represent me in an excessive force case at the time. My life has been really shitty lately, and I just DGAF right now what happens as a result of this. Fucking bring it. I’m a little nervous but mostly just steeled. This country, this world, it’s all going to shit. If I don’t fight for something then what’s the point?. They don’t explain this shit to you ahead of time. I had an appointment with my counselor on Friday, and I knew I needed refills on a couple of my meds, so I thought I would just stop at the desk and let them know. 

“Are you out of your meds?” I told them I had a few days left of one of them but I was pretty sure I was out of the other one (I set up my meds a week at a time). “Well, you have to call the med line and leave a message. Maybe one of our case managers will get back to you today. You shouldn’t have waited so long.” 

I’ve tried to get refills early before and got scolded for that, so I know that’s a big no-no. So I waited. I haven’t had trouble before, and I’ve never been referred to this fucking med line before either. What the actual fuck? So I’m out of my antidepressants, and I’m going to be out of town. Fuck me I guess.I just took a PALS class, and it brought back so many memories of things I have gone through as a nurse. Kids I have seen code, kids I have seen die. Kids I have taken to the morgue. Kids I have known that have died when I wasn’t there. I have been a nurse for 16 years, and maybe it has been the extra stress of the last 2-3 years, but it is hitting me extra hard right now. I have been working with adults for five years, but for some reason this PALS class was super difficult for me. I don’t even see a lot of kids in my practice right now. I just wanted to throw this out there. I am feeling extra sad for my babies and kids, I guess I am missing taking care of them, or maybe just extra sad about the ones I’ve lost. I don’t know. Hope everyone is doing well out there or finding someone to help them cope. It’s rough for us right now, isn’t it?. Between jobs, my wife is in the hospital, my marriage is falling apart, I’m taking care of four kids by myself for the time being, finances are a wreck, I have no friends, my mental health is in the shitter, I just need someone to talk to. My family has never really been there for me. I feel so alone right now. I’m trying so hard to stay afloat, to stay positive. Just need some positive words. Not empty words, but real encouragement.I am a Christian. I am embarrassed by the church at large, especially in recent days. I think all cases of rape should have the option to abort. A violation of that magnitude is devastating and to force a human being who has suffered such an intrusion to carry a baby to term is nothing short of abusive and making that person relive their trauma daily for 9 months straight. I think the notion that life begins at conception is delusional. If someone who has been raped wants to carry their baby, more power to them, but my support goes out to anyone who does not. The pro-life movement has gone off the rails and I do not want to be associated with it.

